Index,Repl name,Timestamp,Time worked,Work done (actions),Items read (lines),Code added,Code removed,Agent usage fee,Description
3,Replit-Export-Tool,"3:49 pm, Feb 03, 2026",2 minutes,19,518,117,158,0.33,"This is a standalone CLI tool, not a web application. I'll create the Node.js tool using Playwright ..."
6,Replit-Export-Tool,"3:49 pm, Feb 03, 2026",13 seconds,,,,,0.06,That message is a temporary Replit platform issue - it happens occasionally when their AI services e...
14,Replit-Export-Tool,"3:58 pm, Feb 03, 2026",6 minutes and 4 seconds,17,116,1216,153,1.55,The Replit Agent Exporter is ready. Here's what was built: Project Structure exporter/ ├── index.ts ...
17,Replit-Export-Tool,"3:58 pm, Feb 03, 2026",16 seconds,,,,,0.36,"Great question! This tool needs to open a visible browser window for you to log in manually, which c..."
20,Replit-Export-Tool,"3:58 pm, Feb 03, 2026",15 seconds,1,,,,0.36,Add Playwright and Commander for Replit agent exporter tool
26,Replit-Export-Tool,"4:49 pm, Feb 03, 2026",1 minute and 50 seconds,6,441,89,14,1.22,I've updated the tool to handle login redirects. Now when you navigate to a repl and get redirected ...
29,Replit-Export-Tool,"4:49 pm, Feb 03, 2026",37 seconds,1,,,,0.38,That makes sense - a simplified CSV that focuses on the work timeline. I'm thinking this would inclu...
33,Replit-Export-Tool,"7:05 am, Feb 04, 2026",2 minutes and 22 seconds,17,435,121,50,1.26,"I've added the new work-tracking.csv output file. Now when you run the exporter, you'll get three ou..."
36,Replit-Export-Tool,"7:05 am, Feb 04, 2026",11 seconds,,,,,0.29,"After you pull the changes from GitHub to your local machine, just run: npm install This will instal..."
39,Replit-Export-Tool,"7:05 am, Feb 04, 2026",16 seconds,1,,,,0.3,This error is happening because of how TypeScript/tsx compiles the code. The __name reference is a h...
43,Replit-Export-Tool,"8:36 am, Feb 04, 2026",1 minute and 53 seconds,8,170,158,154,0.83,I've fixed the error. The issue was that the TypeScript compiler adds helper functions that aren't a...
47,Replit-Export-Tool,"8:36 am, Feb 04, 2026",12 seconds,,,,,0.37,It looks like you're still running the old code - the error is identical to before. The fix I made s...
52,Replit-Export-Tool,"8:36 am, Feb 04, 2026",23 seconds,,,,,0.11,The changes I made in Replit need to be pushed to GitHub first. Replit's checkpoints are saved local...
57,Replit-Export-Tool,"8:36 am, Feb 04, 2026",23 seconds,1,,,,0.12,"The fix is present here in Replit, but it seems like there's a sync issue with GitHub. The easiest s..."
60,Replit-Export-Tool,"8:36 am, Feb 04, 2026",17 seconds,1,,,,0.42,I see the issue now. There are other page.evaluate calls in the scraper that also use arrow function...
70,Replit-Export-Tool,"9:15 am, Feb 04, 2026",3 minutes and 38 seconds,19,518,212,212,1.5,I've fixed all the page.evaluate calls in the scraper. All browser-context code now uses pure ES5 Ja...
73,Replit-Export-Tool,"9:15 am, Feb 04, 2026",29 seconds,1,,,,0.25,I see three issues to fix: __name error persists - The inner function parseTimestamp(el) declaration...
82,Replit-Export-Tool,"9:33 am, Feb 04, 2026",4 minutes and 8 seconds,21,490,374,230,1.61,I've fixed all three issues: 1. Fixed __name error: Converted the inner function declaration functio...
85,Replit-Export-Tool,"9:33 am, Feb 04, 2026",43 seconds,1,,,,0.31,I see the issue. The GitHub OAuth flow completed successfully (you went through 2FA with WebAuthn/SM...
89,Replit-Export-Tool,"9:47 am, Feb 04, 2026",1 minute and 46 seconds,6,100,135,65,0.38,I've fixed the OAuth login issue. The key changes: Replaced waitForURL with polling - Instead of wai...
92,Replit-Export-Tool,"9:47 am, Feb 04, 2026",18 seconds,1,,,,0.25,Update documentation to reflect recent login resilience improvements
97,Replit-Export-Tool,"10:45 am, Feb 04, 2026",1 minute and 26 seconds,8,220,66,46,0.44,"I've fixed both issues: 1. ""Show previous messages"" timeout - Added two safeguards: Failed click cou..."
101,Replit-Export-Tool,"10:45 am, Feb 04, 2026",46 seconds,3,160,,,0.45,I see the problem! Even though the parseTimestamp function is correctly declared as var parseTimesta...
106,Replit-Export-Tool,"10:45 am, Feb 04, 2026",46 seconds,4,30,,,0.2,"Looking at the code more closely, I notice that: Other page.evaluate(function() { ... }) calls work ..."
110,Replit-Export-Tool,"11:05 am, Feb 04, 2026",1 minute and 9 seconds,6,50,43,43,0.72,I've fixed the __name is not defined error. The issue was that tsx transforms even var funcName = fu...
113,Replit-Export-Tool,"11:05 am, Feb 04, 2026",48 seconds,1,,,,0.32,"Looking at the export results, I can see the tool is now running without errors (the __name fix work..."
147,Replit-Export-Tool,"2:43 pm, Feb 07, 2026",10 minutes and 29 seconds,43,1569,463,250,4.73,The exporter code has been cleaned up and compiles without errors. The multi-strategy chat extractio...
150,Replit-Export-Tool,"2:43 pm, Feb 07, 2026",27 seconds,1,,,,0.2,Good news - the dom-debug.json is very revealing. Two issues are clear: The crash: className on SVG ...
162,Replit-Export-Tool,"3:01 pm, Feb 07, 2026",3 minutes and 25 seconds,12,420,289,373,1.31,Here's what I fixed: Root cause 1 — SVG crash: The error className.toLowerCase is not a function hap...
164,Replit-Export-Tool,"3:01 pm, Feb 07, 2026",5 seconds,,,,,0.31,"That's awesome! It's pulling the chat export now. However, it's not showing all the agent response. ..."
173,Replit-Export-Tool,"3:01 pm, Feb 07, 2026",1 minute and 4 seconds,8,1011,,,0.8,"This is really helpful! The DOM debug reveals exactly what we need. Key findings: ""Worked for X"" ele..."
177,Replit-Export-Tool,"3:01 pm, Feb 07, 2026",46 seconds,1,,,,0.46,Thanks for the clarification! That's really helpful. So to summarize: Navigation: The ?tab=agent URL...
199,Replit-Export-Tool,"3:44 pm, Feb 07, 2026",5 minutes and 45 seconds,22,451,596,335,2.57,All changes are complete and reviewed. Here's a summary of what was done: Navigation simplified - Re...
202,Replit-Export-Tool,"3:49 pm, Feb 03, 2026",25 seconds,1,,,,0.3,"Looking at your output files, I can see three clear issues: Timestamps are missing - The checkpoint ..."
205,Replit-Export-Tool,"3:49 pm, Feb 03, 2026",23 seconds,1,,,,0.31,"Great refinements! Let me summarize the plan: work-tracking.csv - Clean, structured columns: replId ..."
208,Replit-Export-Tool,"3:49 pm, Feb 03, 2026",17 seconds,1,,,,0.06,"Got it - just the repl name after /repls/ (e.g., Replit-Export-Tool), used consistently for both fil..."
227,Replit-Export-Tool,"4:28 pm, Feb 07, 2026",7 minutes and 40 seconds,17,1927,361,414,2.93,All the data quality improvements are complete and TypeScript compiles cleanly. Here's a summary of ...
230,Replit-Export-Tool,"4:28 pm, Feb 07, 2026",20 seconds,1,,,,0.35,"Looking at the attached data, I can see three issues: Missing timestamps - Almost all rows have empt..."
233,Replit-Export-Tool,"4:28 pm, Feb 07, 2026",21 seconds,1,,,,0.07,Good points. Let me also address the navigation timeout issue. The tool is trying waitUntil: 'networ...
258,Replit-Export-Tool,"5:05 pm, Feb 07, 2026",10 minutes and 45 seconds,33,2482,570,223,4.36,All seven improvements are implemented and reviewed. Here's a summary of what changed: Navigation fi...
261,Replit-Export-Tool,"5:05 pm, Feb 07, 2026",44 seconds,1,,,,0.31,"Looking at this, the issue is clear. The current extraction code is grabbing items above the ""Agent ..."
296,Replit-Export-Tool,"5:33 pm, Feb 07, 2026",5 minutes and 37 seconds,30,327,137,130,1.98,"Both fixes are done: Agent Usage extraction — The code now finds the ""Agent Usage"" heading element f..."
301,Replit-Export-Tool,"3:49 pm, Feb 03, 2026",38 seconds,2,382,,,0.48,Now I can see the root cause clearly. Looking at the dom-debug: The timestamp elements are <span> el...
319,Replit-Export-Tool,"5:46 pm, Feb 07, 2026",4 minutes and 15 seconds,19,500,279,168,2.5,All changes are complete and compiling cleanly. Here's what was done: Timestamp toggle step - Added ...
325,Replit-Export-Tool,"5:46 pm, Feb 07, 2026",27 seconds,2,,,,0.24,"Just for clarity, this is what I'm seeing when I expand ""..."": Saved progress at the end of the loop  So after you expand all checkpoints, you should see the timestamp after the words ""Saved progress at the end of the loop"" or other similar text after ""Checkpoint made..."". Do we need to modify the JSON files to capture this or was that taken care of on your last run?"
336,Replit-Export-Tool,"5:56 pm, Feb 07, 2026",1 minute and 52 seconds,11,140,42,21,0.82,"Both fixes are done and compiling cleanly. To answer your question directly: Yes, this was already t..."
341,Replit-Export-Tool,"5:46 pm, Feb 07, 2026",27 seconds,3,70,,,0.16,"Now I can see the issue clearly. The description regex on line 1282 expects ...ago (relative timestamp) before the description text. After toggling, the raw text will look like:   Saved progress at the end of the loop         ...instead of the old format with """". Let me fix both the primary regex and the fallback cleanup."
344,Replit-Export-Tool,"6:01 pm, Feb 07, 2026",1 minute and 29 seconds,2,,12,9,0.11,I see the issue you're pointing out. Here's what's happening: Line 1076: timestamp is set from tsMap...
349,Replit-Export-Tool,"3:46 pm, Feb 03, 2026",1 minute and 31 seconds,4,245,,,0.67,Prioritize real timestamps for checkpoint data export
366,Replit-Export-Tool,"6:16 pm, Feb 07, 2026",4 minutes and 25 seconds,18,455,282,329,2.49,"All three fixes are implemented, reviewed, and passing: Expand-then-collapse fix — Clickable element..."
370,Replit-Export-Tool,"6:16 pm, Feb 07, 2026",18 seconds,3,,,,0.12,"I can see the issue. The top/bottom borders are 62 ═ characters wide, but the text lines have incons..."
373,Replit-Export-Tool,"6:16 pm, Feb 07, 2026",9 seconds,1,,,,0.19,"Two changes here: work-tracking.csv headers: Update to match the Replit chat text — ""Time worked"", ""..."
387,Replit-Export-Tool,"6:30 pm, Feb 07, 2026",2 minutes and 11 seconds,16,256,83,48,1.05,Both changes are done: Terminal boxes — All lines now have consistent width. The welcome box uses ma...
390,Replit-Export-Tool,"6:30 pm, Feb 07, 2026",21 seconds,1,,,,0.28,Good observations — there are several issues to fix here. Let me outline the approach: Welcome box o...
393,Replit-Export-Tool,"6:30 pm, Feb 07, 2026",10 seconds,1,,,,0.05,"Good clarification. The ""Show previous messages"" loop is working fine — no changes there. The key po..."
422,Replit-Export-Tool,"7:05 pm, Feb 07, 2026",6 minutes and 30 seconds,30,1599,491,364,3.66,All improvements are complete. Here's a summary of what was done: Welcome box border fix — The top a...
425,Replit-Export-Tool,"3:49 pm, Feb 03, 2026",34 seconds,1,,,,0.2,Great idea on the top-down approach. Walking down line by line and expanding as you go is much more ...
457,Replit-Export-Tool,"7:39 pm, Feb 07, 2026",11 minutes and 0 seconds,44,2768,894,1154,4.52,All changes are complete and compiling cleanly. Here's a summary of what was done: Scraper rewrite —...
460,Replit-Export-Tool,"3:49 pm, Feb 03, 2026",25 seconds,1,,,,0.37,Great observations! Let me address each of your three questions: 1. Hover tooltip for precise time (...
465,Replit-Export-Tool,"3:49 pm, Feb 03, 2026",25 seconds,2,,,,0.13,"Great question. Looking at the code, the fallback currently runs in two scenarios: When no event con..."
490,Replit-Export-Tool,"8:10 pm, Feb 07, 2026",4 minutes and 42 seconds,26,366,103,76,2.54,All three refinements are complete and reviewed: Precise duration extraction - The scraper now reads...
495,Replit-Export-Tool,"8:10 pm, Feb 07, 2026",42 seconds,5,80,,,0.27,"Good, I now have a clear picture of both items. Here's my plan: 1. Work Summary CSV (work-summary.cs..."
498,Replit-Export-Tool,"8:10 pm, Feb 07, 2026",8 seconds,1,,,,0.06,"Got it — the work summary will include both a human-readable duration column (e.g., ""2 hours 15 minu..."
527,Replit-Export-Tool,"8:28 pm, Feb 07, 2026",5 minutes and 58 seconds,32,1213,449,225,2.7,Here's a summary of what was done: Work Summary CSV (work-summary.csv) — New export file that aggreg...
530,Replit-Export-Tool,"8:28 pm, Feb 07, 2026",11 seconds,1,,,,0.07,"Good to know the Agent Usage click is working correctly — that means the expansion side is solid, an..."
536,Replit-Export-Tool,"8:34 pm, Feb 07, 2026",55 seconds,4,60,38,19,0.38,Clean compile. Let me do the architect review:
539,Replit-Export-Tool,"8:34 pm, Feb 07, 2026",10 seconds,1,,,,0.07,Improve checkpoint description formatting by separating timestamps
545,Replit-Export-Tool,"8:38 pm, Feb 07, 2026",1 minute and 37 seconds,7,45,5,38,0.8,"Now I'll replace the "" - "" delimiter approach with a simple strip. The entire block from line 799–81..."
551,Replit-Export-Tool,"8:38 pm, Feb 07, 2026",2 minutes and 13 seconds,7,975,,,0.76,I've analyzed the terminal output and the output files carefully. Here's what I found: Root cause of...
554,Replit-Export-Tool,"8:38 pm, Feb 07, 2026",28 seconds,1,,,,0.13,"Clean compile. Much simpler now — the checkpoint description is just the raw text with """", relative timestamps, absolute timestamps, and UI labels all stripped out. The result is a clean description like ""Transitioned from Plan to Build mode""."
557,Replit-Export-Tool,"8:38 pm, Feb 07, 2026",18 seconds,1,,,,0.07,"Done. The checkpoint description extraction is now much simpler — it strips relative timestamps like """" entirely since they're just artifacts of when the scrape ran. Checkpoints already have proper absolute timestamps, so the descriptions now come out clean (e.g., ""Transitioned from Plan to Build mode"" with no leftover relative time text). This replaced about 25 lines of complex regex logic with a straightforward 5-line chain of .replace() calls."
583,Replit-Export-Tool,"9:14 pm, Feb 07, 2026",7 minutes and 19 seconds,30,1254,281,265,3.26,Here's a summary of all the changes made: Agent Usage Expansion - Completely rewritten to be safer a...
586,Replit-Export-Tool,"9:14 pm, Feb 07, 2026",14 seconds,1,,,,0.05,Good points on all three. Here's what I'll do: Remove parent/grandparent fallbacks - Only click the ...
610,Replit-Export-Tool,"9:24 pm, Feb 07, 2026",4 minutes and 57 seconds,28,790,70,167,1.97,"Here's a summary of all three changes: 1. AU expansion stripped down - Only clicks the exact ""Agent ..."
616,Replit-Export-Tool,"9:24 pm, Feb 07, 2026",1 minute and 22 seconds,7,280,,,0.55,Good findings. Here's what I think is happening and the plan: On the collapsing theory (#1): Your hy...
619,Replit-Export-Tool,"9:24 pm, Feb 07, 2026",9 seconds,1,,,,0.05,Good additions. Let me update the plan to include those: Fix the collapsing bug - Check if Agent Usa...
624,Replit-Export-Tool,"9:24 pm, Feb 07, 2026",37 seconds,5,90,,,0.2,"Now I need to think about what ""description"" to attach. The work entries don't currently capture wha..."
627,Replit-Export-Tool,"9:24 pm, Feb 07, 2026",11 seconds,1,,,,0.05,"Good idea. Right now, relative timestamps like ""4 days ago"" slip through because the timestamp toggl..."
630,Replit-Export-Tool,"9:24 pm, Feb 07, 2026",18 seconds,1,,,,0.06,That's a great insight. You're right - the simpler approach was working better. The problem is likel...
651,Replit-Export-Tool,"10:00 pm, Feb 07, 2026",4 minutes and 5 seconds,28,453,159,78,1.83,Here's a summary of all the changes: 1. Fixed the collapsing bug - Removed the separate Agent Usage ...
654,Replit-Export-Tool,"10:00 pm, Feb 07, 2026",20 seconds,1,,,,0.39,That makes total sense. Simplifying the code by removing the agent usage detail extraction will make...
658,Replit-Export-Tool,"10:00 pm, Feb 07, 2026",25 seconds,2,50,,,0.13,"Since messages, work entries, and checkpoints all share the same index counter, the index numbers ar..."
663,Replit-Export-Tool,"10:00 pm, Feb 07, 2026",30 seconds,2,,,,0.14,"Checkpoints already have descriptions like ""Simplify agent usage expansion and charge detail extract..."
677,Replit-Export-Tool,"10:30 pm, Feb 07, 2026",4 minutes and 5 seconds,31,471,123,314,2.37,All seven tasks are complete and reviewed. Here's what was done: Simplification complete. The agent ...
684,Replit-Export-Tool,"10:30 pm, Feb 07, 2026",55 seconds,7,190,,,0.41,Now I have a clear picture. Here's my analysis: 1. all-events.csv — Straightforward: I'll add the in...
687,Replit-Export-Tool,"10:30 pm, Feb 07, 2026",22 seconds,1,,,,0.24,"Great question. Now that we've simplified to just three expansion targets, let me think through the ..."
690,Replit-Export-Tool,"10:30 pm, Feb 07, 2026",22 seconds,1,,,,0.06,"You're right to push back on that. Let me reconsider. Can we get everything in a single pass? Yes, a..."
704,Replit-Export-Tool,"10:58 pm, Feb 07, 2026",3 minutes and 59 seconds,21,1153,300,295,1.52,Verifying Replit Agent Exporter changes
707,Replit-Export-Tool,"10:58 pm, Feb 07, 2026",4 minutes and 33 seconds,22,1153,300,295,0.93,All changes are complete. Here's a summary of what was done: Two-phase processing rewrite: Phase 1 (...
711,Replit-Export-Tool,"10:58 pm, Feb 07, 2026",55 seconds,3,80,,,0.43,Improve chat history scraping by expanding targeted sections before extraction
729,Replit-Export-Tool,"11:13 pm, Feb 07, 2026",3 minutes and 34 seconds,23,425,238,42,1.59,"All done. Here's what was implemented: Hover-based precise duration extraction — a new ""Phase 2.5"" s..."
733,Replit-Export-Tool,"11:13 pm, Feb 07, 2026",23 seconds,3,70,,,0.42,"Exactly right. The current logic finds the nearest checkpoint within 5 indices of the work entry, bu..."
746,Replit-Export-Tool,"11:22 pm, Feb 07, 2026",2 minutes and 14 seconds,15,105,75,52,0.9,Done. Here's what changed: Boilerplate filtering — Two auto-generated checkpoint descriptions are no...
751,Replit-Export-Tool,"11:22 pm, Feb 07, 2026",1 minute and 21 seconds,4,180,,,0.42,Now I can see both issues clearly: Issue 1 (Precise durations): The data-precise-duration attribute ...
755,Replit-Export-Tool,"11:22 pm, Feb 07, 2026",37 seconds,2,80,,,0.25,Now I see it clearly. Let me trace both issues: Issue 1 (Precise duration): The code at line 640 rea...
781,Replit-Export-Tool,"11:43 pm, Feb 07, 2026",5 minutes and 27 seconds,32,407,193,114,2.28,Here's a summary of both fixes: Fix 1 — No more false work entries from chat messages: The tool now ...
786,Replit-Export-Tool,"11:43 pm, Feb 07, 2026",49 seconds,5,118,,,0.63,"I think I see the problem. The boilerplate patterns use exact-match anchors (^...$), so if the check..."
791,Replit-Export-Tool,"11:43 pm, Feb 07, 2026",1 minute and 0 seconds,5,210,,,0.45,"Now I can see the full picture. Here's what's happening: The performance bottleneck: When the ""Show ..."
812,Replit-Export-Tool,"7:25 am, Feb 08, 2026",4 minutes and 12 seconds,25,295,179,103,1.46,"Is there any code that we can remove? Are there any checks that are redundant or otherwise unnecessary. We should only expand one level when we find the 3 primary cases: X messages & X actions X... Worked for X... If there is code attempting to make other expansions or running additional checks, then let's see if we can remove it."
819,Replit-Export-Tool,"7:25 am, Feb 08, 2026",47 seconds,4,90,,,0.23,"The expandTargetedSections method (lines 354-393) is already clean — it only clicks the three patterns you described and skips everything else (line 379: if (!isMessageActions && !isCheckpoint && !isWorkedFor) continue). Now let me check if there's any other expansion logic elsewhere:"
845,Replit-Export-Tool,"7:34 am, Feb 08, 2026",3 minutes and 3 seconds,24,335,53,154,1.48,Here's what was cleaned up: Removed (~60 lines): The relative timestamp re-click logic that ran duri...
852,Replit-Export-Tool,"7:34 am, Feb 08, 2026",1 minute and 30 seconds,8,293,,,0.59,"Good, I have a clear picture now. Here's my approach: 1. Add GitCommit type — A new interface in typ..."
855,Replit-Export-Tool,"7:34 am, Feb 08, 2026",22 seconds,1,,,,0.22,"Good points, let me refine the approach: Tooltip extraction — You're right that hover tooltips have ..."
891,Replit-Export-Tool,"8:01 am, Feb 08, 2026",6 minutes and 33 seconds,36,513,621,210,2.67,All done. Here's a summary of what was implemented: Git Commit Scraping — After scraping the chat hi...
894,Replit-Export-Tool,"8:01 am, Feb 08, 2026",43 seconds,,,,,0.3,"Good question. Let me trace through the logic to check. The scenario: Between a ""Saved progress"" com..."
900,Replit-Export-Tool,"8:01 am, Feb 08, 2026",1 minute and 2 seconds,5,200,,,0.36,"I found the likely cause. During the recent code cleanup, we made the extraction phase ""fully read-o..."
903,Replit-Export-Tool,"8:01 am, Feb 08, 2026",17 seconds,1,,,,0.24,You're right — the approach has gotten overcomplicated. Let me simplify radically based on what you'...
907,Replit-Export-Tool,"8:01 am, Feb 08, 2026",43 seconds,3,130,,,0.14,"Good catches. Let me trace through what's happening: toggleTimestamps clicks elements with class*=""T..."
933,Replit-Export-Tool,"8:57 am, Feb 08, 2026",5 minutes and 4 seconds,25,743,250,124,2.19,Here's a summary of the changes: Removed toggleTimestamps — This was clicking switch-type elements t...
938,Replit-Export-Tool,"8:57 am, Feb 08, 2026",30 seconds,3,120,,,0.23,"I can see the issue. The git commit selectors are looking for specific DOM classes like [class*=""com..."
941,Replit-Export-Tool,"8:57 am, Feb 08, 2026",55 seconds,1,,,,0.35,This is a fantastic discovery. The single-click timestamp conversion is a game-changer — it eliminat...
944,Replit-Export-Tool,"8:57 am, Feb 08, 2026",17 seconds,1,,,,0.17,"In the terminal results summary I'm seeing this: Results summary: Messages: 708 (66 user, 642 agent) Checkpoints: 82 Work entries: 105 Git commits: 1 Items with timestamps: 895/895 Saved: exports/Replit-Export-Tool.json Why are git commits = 1? I see dozens of commits in the git tab. Also, it would be great if the result included a ""worked for X {time}"" so we can see if our work is getting more or less efficient"
968,Replit-Export-Tool,"9:25 am, Feb 08, 2026",7 minutes and 17 seconds,29,1931,666,678,3.26,All tasks are complete. Here's a summary of the changes made: Pipeline Restructured (Steps 1-5): Loa...
971,Replit-Export-Tool,"9:25 am, Feb 08, 2026",12 seconds,1,,,,0.05,Good catch! You're right — the Git tab timestamps might already be absolute if the user (or a previo...
979,Replit-Export-Tool,"9:28 am, Feb 08, 2026",59 seconds,6,70,47,19,0.3,Reviewing timestamp absolute check
982,Replit-Export-Tool,"9:28 am, Feb 08, 2026",14 seconds,1,,,,0.12,Improve git timestamp handling to prevent unnecessary clicks
999,Replit-Export-Tool,"9:36 am, Feb 08, 2026",4 minutes and 43 seconds,14,200,611,344,1.4,Done. The clickOneRelativeTimestamp method now follows the logic you described: Find a commit descri...
1002,Replit-Export-Tool,"9:36 am, Feb 08, 2026",10 seconds,,,,,0.07,"Yes, I'm referring to the Git tab. To clarify what that comment was about: The old code used a CSS s..."
1009,Replit-Export-Tool,"9:40 am, Feb 08, 2026",1 minute and 43 seconds,5,151,13,5,0.83,The replit.md is now updated to reflect the latest implementation. The key additions/changes are: Co...
1012,Replit-Export-Tool,"9:40 am, Feb 08, 2026",14 seconds,1,,,,0.09,Update documentation to reflect latest implementation details
1018,Replit-Export-Tool,"9:43 am, Feb 08, 2026",53 seconds,4,40,6,3,0.34,Now let me add the waitForAgentIdle method. I'll add it right before the scrapeGitCommits method:
1021,Replit-Export-Tool,"9:43 am, Feb 08, 2026",11 seconds,1,,,,0.07,Add a check to ensure the Replit Agent is idle before scraping
1031,Replit-Export-Tool,"9:46 am, Feb 08, 2026",2 minutes and 7 seconds,8,8,153,3,1.03,The waitForAgentIdle method is now implemented and positioned correctly in the pipeline. Here's what...
1035,Replit-Export-Tool,"9:46 am, Feb 08, 2026",15 seconds,1,,,,0.17,"You're right — the selectors are too broad. Things like [class*=""status"" i] or [class*=""indicator"" i..."
1042,Replit-Export-Tool,"10:08 am, Feb 08, 2026",1 minute and 42 seconds,7,130,79,123,0.49,The detection is now much tighter. Here's what changed: Extracted checkAgentWorking() — shared by bo...
1045,Replit-Export-Tool,"10:08 am, Feb 08, 2026",12 seconds,1,,,,0.05,That's very helpful clarification. So the key signals are: The input button in the agent chat box — ...
1071,Replit-Export-Tool,"10:18 am, Feb 08, 2026",5 minutes and 41 seconds,32,203,320,254,2.25,The detection is now much more precise. Here's the summary: Scoped to the agent chat panel only — wo...
1074,Replit-Export-Tool,"10:18 am, Feb 08, 2026",1 minute and 1 second,1,,,,0.44,"Great questions! Let me address both. Regarding the colon character: No, : is not OS-agnostic. Windo..."
1077,Replit-Export-Tool,"10:18 am, Feb 08, 2026",14 seconds,1,,,,0.31,Good catch on the work-summary file. Let me make sure I understand the requirements: Per-run work-su...
1080,Replit-Export-Tool,"10:18 am, Feb 08, 2026",12 seconds,1,,,,0.06,Got it — so the structure will be: Per-URL directory (ReplName - YYYYMMDD_HHMM/): Contains all that ...
1102,Replit-Export-Tool,"11:23 am, Feb 08, 2026",6 minutes and 40 seconds,38,3415,283,70,3.72,Transitioned from Plan to Build mode